{
  "id": "demo-anti-pattern-contract-field-drift",
  "kind": "anti_pattern",
  "status": "candidate",
  "statement": "Do not rename a shared response field in only the consumer or only the producer.",
  "rationale": "Demo knowledge from DEMO-API contract mismatch.",
  "applies_to": {
    "roles": [
      "backend_dev",
      "frontend_dev",
      "backend_test"
    ],
    "components": [],
    "repos": [],
    "services": [],
    "tasks": [],
    "tags": [
      "contract",
      "mismatch"
    ]
  },
  "confidence": "medium",
  "source_event_ids": [],
  "evidence": [
    "DEMO-API"
  ],
  "usage_count": 0,
  "created_at": "2026-06-18T22:56:16.562Z",
  "updated_at": "2026-06-18T22:56:16.562Z",
  "promoted_at": "",
  "deprecated_at": "",
  "supersedes": [],
  "superseded_by": ""
}
