{
  "id": "demo-process-rule-contract-boundary-split",
  "kind": "process_rule",
  "status": "promoted",
  "statement": "Split frontend and backend tasks at an explicit contract boundary before allowing parallel execution.",
  "rationale": "Demo knowledge from DEMO-CHECKOUT.",
  "applies_to": {
    "roles": [
      "project_manager",
      "orchestrator"
    ],
    "components": [],
    "repos": [],
    "services": [],
    "tasks": [],
    "tags": [
      "parallel",
      "contract"
    ]
  },
  "confidence": "medium",
  "source_event_ids": [],
  "evidence": [
    "DEMO-CHECKOUT"
  ],
  "usage_count": 0,
  "created_at": "2026-06-18T22:56:16.562Z",
  "updated_at": "2026-06-18T22:56:16.562Z",
  "promoted_at": "2026-06-18T22:56:16.562Z",
  "deprecated_at": "",
  "supersedes": [],
  "superseded_by": ""
}
